{
  "contract_version": "1.0.0",
  "schema_version": 1,
  "manifest_id": "3b74fd33-aba5-433b-98ba-3452473f5f0e",
  "phase": 199,
  "status": "CERTIFIED",
  "covered_phases": [
    100,
    110,
    120,
    130,
    140,
    150,
    160,
    170,
    180,
    190,
    195
  ],
  "repositories": {
    "product": {
      "repository": "mykai05/ENTRAL-0.2",
      "main_sha": "f1e4ba62bc60986cb8e7366a35ac9a92aeda0abb"
    },
    "control_website": {
      "repository": "SovereignProtocol/sovereign-protocol-agent",
      "main_sha": "8f1923fcec20a11dc0aef304c0e05827fe2cb5c5"
    }
  },
  "deployments": [
    {
      "role": "FRONTEND",
      "provider": "VERCEL",
      "deployment_id": "dpl_CavKw8FjsQLxpiALtZ5FXWLyjD9t",
      "deployed_commit_sha": "f1e4ba62bc60986cb8e7366a35ac9a92aeda0abb",
      "production_url": "https://entral-0-2-frontend.vercel.app",
      "status": "READY"
    },
    {
      "role": "API",
      "provider": "RAILWAY",
      "deployment_id": "04bd83dc-0545-4b13-9a32-83580cec8f75",
      "deployed_commit_sha": "f1e4ba62bc60986cb8e7366a35ac9a92aeda0abb",
      "production_url": "https://entral-backend-production.up.railway.app/health",
      "status": "READY"
    },
    {
      "role": "WORKER",
      "provider": "RAILWAY",
      "deployment_id": "3344f2f6-a367-4548-8aab-f5ae6890ee46",
      "deployed_commit_sha": "f1e4ba62bc60986cb8e7366a35ac9a92aeda0abb",
      "production_url": "https://entral-backend-production.up.railway.app/health",
      "status": "READY"
    }
  ],
  "migrations": [
    {
      "name": "20260726190000_phase_195_graph_preferences_release_evidence_and_worker_readiness",
      "status": "APPLIED",
      "checksum_sha256": "ecf35807e29fc17f9d3d36846dfbb568602569aefe219080ee9cfaa50efac651",
      "production_readback_sha256": "cfeb76852b68dee2d877eab0202fa628f5e6b3cad7bc159928b90c10ba403c86"
    }
  ],
  "runtime_versions": {
    "node": "20.19.0",
    "pnpm": "9.12.3",
    "postgres": "18.4",
    "redis": "8.2.8"
  },
  "requirements": [
    {
      "requirement_id": "P100-BASELINE",
      "phase": 100,
      "state": "VERIFIED_COMPLETE",
      "summary": "Phase 100 accepted architecture and repository behavior were re-evaluated against current origin/main and the certified Phase 198 production baseline.",
      "evidence": [
        {
          "path_or_id": "mykai05/ENTRAL-0.2@73d34f0f2ad74c29c1481dcc47cf4f30f950e467:docs/entral/100_repository_baseline.md",
          "content_sha256": null,
          "evidence_type": "SOURCE"
        },
        {
          "path_or_id": "mykai05/ENTRAL-0.2@73d34f0f2ad74c29c1481dcc47cf4f30f950e467:scripts/release-positioning.test.mjs",
          "content_sha256": null,
          "evidence_type": "TEST"
        },
        {
          "path_or_id": "mykai05/ENTRAL-0.2@f9bba0b275798664374b96630cc2c34a8d8ffe33:.entral/governor/releases/phase-198.json",
          "content_sha256": null,
          "evidence_type": "PRODUCTION_READBACK"
        }
      ],
      "limitation": null,
      "completion_gate": "Gate 100 - Repository Baseline Completion Record"
    },
    {
      "requirement_id": "P110-BASELINE",
      "phase": 110,
      "state": "VERIFIED_COMPLETE",
      "summary": "Phase 110 accepted architecture and repository behavior were re-evaluated against current origin/main and the certified Phase 198 production baseline.",
      "evidence": [
        {
          "path_or_id": "mykai05/ENTRAL-0.2@73d34f0f2ad74c29c1481dcc47cf4f30f950e467:docs/entral/ui/110_ui_baseline.md",
          "content_sha256": null,
          "evidence_type": "SOURCE"
        },
        {
          "path_or_id": "mykai05/ENTRAL-0.2@73d34f0f2ad74c29c1481dcc47cf4f30f950e467:frontend/tests/UICleanup.test.tsx",
          "content_sha256": null,
          "evidence_type": "TEST"
        },
        {
          "path_or_id": "mykai05/ENTRAL-0.2@f9bba0b275798664374b96630cc2c34a8d8ffe33:.entral/governor/releases/phase-198.json",
          "content_sha256": null,
          "evidence_type": "PRODUCTION_READBACK"
        }
      ],
      "limitation": null,
      "completion_gate": "Gate 110 - UI Baseline Consolidation"
    },
    {
      "requirement_id": "P120-BASELINE",
      "phase": 120,
      "state": "VERIFIED_COMPLETE",
      "summary": "Phase 120 accepted architecture and repository behavior were re-evaluated against current origin/main and the certified Phase 198 production baseline.",
      "evidence": [
        {
          "path_or_id": "mykai05/ENTRAL-0.2@73d34f0f2ad74c29c1481dcc47cf4f30f950e467:docs/entral/120_data_intelligence_implementation_map.md",
          "content_sha256": null,
          "evidence_type": "SOURCE"
        },
        {
          "path_or_id": "mykai05/ENTRAL-0.2@73d34f0f2ad74c29c1481dcc47cf4f30f950e467:scripts/release-positioning.test.mjs",
          "content_sha256": null,
          "evidence_type": "TEST"
        },
        {
          "path_or_id": "mykai05/ENTRAL-0.2@f9bba0b275798664374b96630cc2c34a8d8ffe33:.entral/governor/releases/phase-198.json",
          "content_sha256": null,
          "evidence_type": "PRODUCTION_READBACK"
        }
      ],
      "limitation": null,
      "completion_gate": "Gate 120 - Data, Memory, and Intelligence Implementation Map Acceptance"
    },
    {
      "requirement_id": "P130-BASELINE",
      "phase": 130,
      "state": "VERIFIED_COMPLETE",
      "summary": "Phase 130 accepted architecture and repository behavior were re-evaluated against current origin/main and the certified Phase 198 production baseline.",
      "evidence": [
        {
          "path_or_id": "mykai05/ENTRAL-0.2@5c4eb1ca78ba72a90ddb065b60aeb4804b79b517:docs/PHASE_130_SHARED_CONTRACTS.md",
          "content_sha256": null,
          "evidence_type": "SOURCE"
        },
        {
          "path_or_id": "mykai05/ENTRAL-0.2@5c4eb1ca78ba72a90ddb065b60aeb4804b79b517:packages/contracts/tests/contracts.test.mjs",
          "content_sha256": null,
          "evidence_type": "TEST"
        },
        {
          "path_or_id": "mykai05/ENTRAL-0.2@f9bba0b275798664374b96630cc2c34a8d8ffe33:.entral/governor/releases/phase-198.json",
          "content_sha256": null,
          "evidence_type": "PRODUCTION_READBACK"
        }
      ],
      "limitation": null,
      "completion_gate": "Phase 130 Shared Contracts Boundary Gate"
    },
    {
      "requirement_id": "P140-BASELINE",
      "phase": 140,
      "state": "VERIFIED_COMPLETE",
      "summary": "Phase 140 accepted architecture and repository behavior were re-evaluated against current origin/main and the certified Phase 198 production baseline.",
      "evidence": [
        {
          "path_or_id": "mykai05/ENTRAL-0.2@3b4bda8eee6a8a88968a67c7503a49aff8114265:docs/phase-140-database-foundation.md",
          "content_sha256": null,
          "evidence_type": "SOURCE"
        },
        {
          "path_or_id": "mykai05/ENTRAL-0.2@3b4bda8eee6a8a88968a67c7503a49aff8114265:backend/tests/canonicalControlPlanePostgres.integration.test.ts",
          "content_sha256": null,
          "evidence_type": "TEST"
        },
        {
          "path_or_id": "mykai05/ENTRAL-0.2@f9bba0b275798664374b96630cc2c34a8d8ffe33:.entral/governor/releases/phase-198.json",
          "content_sha256": null,
          "evidence_type": "PRODUCTION_READBACK"
        }
      ],
      "limitation": null,
      "completion_gate": "Phase 140 Canonical Database Foundation Gate"
    },
    {
      "requirement_id": "P150-BASELINE",
      "phase": 150,
      "state": "VERIFIED_COMPLETE",
      "summary": "Phase 150 accepted architecture and repository behavior were re-evaluated against current origin/main and the certified Phase 198 production baseline.",
      "evidence": [
        {
          "path_or_id": "mykai05/ENTRAL-0.2@47c8ecc6c66c35e316840fa206a6f307db3f3c57:docs/PHASE_150_DATABASE_IDENTITY_RUNBOOK.md",
          "content_sha256": null,
          "evidence_type": "SOURCE"
        },
        {
          "path_or_id": "mykai05/ENTRAL-0.2@47c8ecc6c66c35e316840fa206a6f307db3f3c57:backend/tests/phase150DatabaseAccess.integration.test.ts",
          "content_sha256": null,
          "evidence_type": "TEST"
        },
        {
          "path_or_id": "mykai05/ENTRAL-0.2@f9bba0b275798664374b96630cc2c34a8d8ffe33:.entral/governor/releases/phase-198.json",
          "content_sha256": null,
          "evidence_type": "PRODUCTION_READBACK"
        }
      ],
      "limitation": null,
      "completion_gate": "Phase 150 PostgreSQL Identity, Integrity, and Access Gate"
    },
    {
      "requirement_id": "P160-BASELINE",
      "phase": 160,
      "state": "VERIFIED_COMPLETE",
      "summary": "Phase 160 accepted architecture and repository behavior were re-evaluated against current origin/main and the certified Phase 198 production baseline.",
      "evidence": [
        {
          "path_or_id": "mykai05/ENTRAL-0.2@62f4cc4167583e6e0a87cd209a6f63dd5ca0e891:docs/PHASE_160_CANONICAL_TAXONOMY_RUNBOOK.md",
          "content_sha256": null,
          "evidence_type": "SOURCE"
        },
        {
          "path_or_id": "mykai05/ENTRAL-0.2@62f4cc4167583e6e0a87cd209a6f63dd5ca0e891:backend/tests/phase160CanonicalTaxonomyPostgres.integration.test.ts",
          "content_sha256": null,
          "evidence_type": "TEST"
        },
        {
          "path_or_id": "mykai05/ENTRAL-0.2@f9bba0b275798664374b96630cc2c34a8d8ffe33:.entral/governor/releases/phase-198.json",
          "content_sha256": null,
          "evidence_type": "PRODUCTION_READBACK"
        }
      ],
      "limitation": null,
      "completion_gate": "Phase 160 Canonical Taxonomy PostgreSQL Gate"
    },
    {
      "requirement_id": "P170-BASELINE",
      "phase": 170,
      "state": "VERIFIED_COMPLETE",
      "summary": "Phase 170 accepted architecture and repository behavior were re-evaluated against current origin/main and the certified Phase 198 production baseline.",
      "evidence": [
        {